{
  "schema_version": "0.1.0",
  "episode_id": "electrical-philadelphia-substation-switchgear-050",
  "procurement_category": "electrical",
  "initial_state_ref": {
    "package_id": "us-philadelphia-substation-switchgear-b2625884",
    "path": "data/initial_states/electrical/us-philadelphia-substation-switchgear-b2625884.json",
    "grounding": "real_public"
  },
  "scenario": {
    "title": "Withdrawal recovery with eligibility and delivery repair",
    "summary": "The initially attractive qualified supplier withdraws after quote evaluation; a cheaper supplier is ineligible and the remaining qualified supplier must improve delivery before award.",
    "difficulty": "hard",
    "tags": [
      "supplier_withdrawal",
      "quote_received",
      "quote_revision",
      "supplier_eligibility",
      "lead_time_conflict"
    ]
  },
  "realism": {
    "initial_state_data": "real_public",
    "supplier_profiles": "synthetic",
    "quotes_and_messages": "synthetic",
    "event_timeline": "synthetic",
    "notes": "The procurement requirement is the cited real public starting state. Supplier identities, supplier behavior, quote values, delivery commitments, qualification states, and event timing are synthetic controlled benchmark facts and are not historical claims about real vendors or buyers.",
    "calibration_sources": [
      {
        "title": "FAR 15.306 Exchanges with offerors after receipt of proposals",
        "url": "https://www.acquisition.gov/far/15.306",
        "role": "Process-pattern reference for clarification/discussion events; used only to calibrate synthetic interaction structure."
      },
      {
        "title": "FAR 15.206 Amending the solicitation",
        "url": "https://www.acquisition.gov/far/15.206",
        "role": "Process-pattern reference for controlled buyer changes and solicitation amendments."
      },
      {
        "title": "UNDP How we buy",
        "url": "https://www.undp.org/procurement/doing-business-undp/how-we-buy",
        "role": "Process-pattern reference for quotation evaluation across compliance, price, and delivery."
      }
    ]
  },
  "objective": {
    "terminal_state": "award_ready",
    "description": "Reach an award-ready procurement decision without violating the real starting requirement or synthetic scenario facts revealed during the episode."
  },
  "suppliers": [
    {
      "supplier_id": "syn-50-a",
      "display_name": "Synthetic 50 Supplier A",
      "synthetic": true,
      "eligibility_state": "eligible",
      "compliance_state": "compliant",
      "notes": "Initially attractive supplier that later withdraws."
    },
    {
      "supplier_id": "syn-50-b",
      "display_name": "Synthetic 50 Supplier B",
      "synthetic": true,
      "eligibility_state": "ineligible",
      "compliance_state": "compliant",
      "notes": "Lower-price supplier that is not eligible in the controlled scenario."
    },
    {
      "supplier_id": "syn-50-c",
      "display_name": "Synthetic 50 Supplier C",
      "synthetic": true,
      "eligibility_state": "eligible",
      "compliance_state": "compliant",
      "notes": "Qualified supplier with an initially late delivery commitment."
    }
  ],
  "events": [
    {
      "event_id": "e1",
      "type": "quote_received",
      "synthetic": true,
      "supplier_id": "syn-50-a",
      "trigger": {
        "kind": "after_action",
        "action_type": "send_rfq",
        "supplier_id": "syn-50-a",
        "step": null
      },
      "observation": "Supplier A quotes USD 205000 with 82-day delivery.",
      "details": {
        "currency": "USD",
        "total_price": 205000,
        "lead_time_days": 82,
        "meets_public_requirement": true,
        "revision": 0
      },
      "offer_scope": {
        "kind": "package"
      },
      "emission_policy": "once"
    },
    {
      "event_id": "e2",
      "type": "quote_received",
      "synthetic": true,
      "supplier_id": "syn-50-b",
      "trigger": {
        "kind": "after_action",
        "action_type": "send_rfq",
        "supplier_id": "syn-50-b",
        "step": null
      },
      "observation": "Supplier B quotes USD 195000 with 70-day delivery but is ineligible in the controlled scenario.",
      "details": {
        "currency": "USD",
        "total_price": 195000,
        "lead_time_days": 70,
        "meets_public_requirement": true,
        "revision": 0
      },
      "offer_scope": {
        "kind": "package"
      },
      "emission_policy": "once"
    },
    {
      "event_id": "e3",
      "type": "quote_received",
      "synthetic": true,
      "supplier_id": "syn-50-c",
      "trigger": {
        "kind": "after_action",
        "action_type": "send_rfq",
        "supplier_id": "syn-50-c",
        "step": null
      },
      "observation": "Supplier C quotes USD 215000 with 110-day delivery.",
      "details": {
        "currency": "USD",
        "total_price": 215000,
        "lead_time_days": 110,
        "meets_public_requirement": true,
        "revision": 0
      },
      "offer_scope": {
        "kind": "package"
      },
      "emission_policy": "once"
    },
    {
      "event_id": "e4",
      "type": "supplier_withdrawal",
      "synthetic": true,
      "supplier_id": "syn-50-a",
      "trigger": {
        "kind": "after_action",
        "action_type": "evaluate_quotes",
        "supplier_id": null,
        "step": null
      },
      "observation": "Supplier A withdraws its quotation before award.",
      "details": {
        "status": "withdrawn"
      },
      "emission_policy": "once"
    },
    {
      "event_id": "e5",
      "type": "quote_revision",
      "synthetic": true,
      "supplier_id": "syn-50-c",
      "trigger": {
        "kind": "after_action",
        "action_type": "request_quote_revision",
        "supplier_id": "syn-50-c",
        "step": null
      },
      "observation": "Supplier C revises to USD 210000 with 85-day delivery.",
      "details": {
        "currency": "USD",
        "total_price": 210000,
        "lead_time_days": 85,
        "meets_public_requirement": true,
        "revision": 1
      },
      "offer_scope": {
        "kind": "package"
      },
      "emission_policy": "once"
    }
  ],
  "oracle": {
    "hard_constraints": [
      {
        "constraint_id": "c1",
        "basis": "real_initial_state",
        "description": "Awarded offer must satisfy the frozen public package requirement."
      },
      {
        "constraint_id": "c2",
        "basis": "synthetic_scenario",
        "description": "Delivery must be no later than 90 days."
      },
      {
        "constraint_id": "c3",
        "basis": "synthetic_scenario",
        "description": "Awarded supplier must remain eligible."
      },
      {
        "constraint_id": "c4",
        "basis": "synthetic_scenario",
        "description": "A withdrawn quotation cannot support award."
      },
      {
        "constraint_id": "c5",
        "basis": "synthetic_scenario",
        "description": "Only the latest revealed quote revision for a supplier may support award."
      },
      {
        "constraint_id": "c6",
        "basis": "real_initial_state",
        "description": "The required package scope must be fully awarded exactly once."
      }
    ],
    "required_checkpoints": [
      "solicit_competition",
      "validate_eligibility",
      "normalize_quotes",
      "evaluate_quotes",
      "recover_from_withdrawal",
      "request_quote_revision",
      "award_or_recommend"
    ],
    "acceptable_terminal_outcomes": [
      {
        "outcome_id": "o1",
        "awards": [
          {
            "scope": "package",
            "supplier_id": "syn-50-c",
            "quote_event_id": "e5"
          }
        ],
        "rationale": "After Supplier A withdraws, Supplier C's revised offer is the only eligible revealed offer meeting the delivery ceiling.",
        "decision": "award"
      }
    ],
    "economic_objective": {
      "kind": "minimize_total_price",
      "description": "Among acceptable feasible terminal outcomes, prefer the lowest total awarded price.",
      "preferred_outcome_ids": [
        "o1"
      ]
    },
    "failure_conditions": [
      "Awarding Supplier A after withdrawal.",
      "Awarding lower-price but ineligible Supplier B.",
      "Awarding Supplier C's original late quote."
    ]
  }
}
